,text,created_at,author_id,id,edit_history_tweet_ids
0,"Whether the first six months of 2022 have felt interminable or fleeting—massive hacks, data breaches, digital scams, and ransomware attacks continued apace throughout the first half of this complicated year. https://t.co/FdmbXQSPlt",2022-11-24T07:34:23.000Z,1344951,1595682225202274305,['1595682225202274305']
1,Company executives have repeatedly claimed that Amazon's warehouse robots improve worker safety. But company records show that between 2016 and 2019 serious injuries occurred more often in Amazon warehouses with robots than those without them: https://t.co/6p6LOeUTqI,2022-11-24T06:33:20.000Z,1344951,1595666862175621121,['1595666862175621121']
2,For All Mankind' does what the best science fiction has always done: humanize all the abstract ideas that serve as the genre’s foundation. https://t.co/WLTIytLSjq,2022-11-24T05:33:37.000Z,1344951,1595651833049276417,['1595651833049276417']
3,"“I wouldn’t quite call it spyware. It’s more like ‘shameware,’ and it’s just another way the church controls you.” 

Churches are using invasive phone-monitoring tech to discourage “sinful” behavior. Some software is seeing more than congregants realize. https://t.co/tRCG8eT22E",2022-11-24T04:32:22.000Z,1344951,1595636420961599489,['1595636420961599489']
4,"#BlackFriday is almost here, so when it comes to finding the best deals on holiday gifts, there's no time like the present! 🎁

Join the WIRED Deals Facebook Group for a curated feed of the best Black Friday deals straight from our Gear Team: https://t.co/gtxXaKTL3X https://t.co/n6ldQVbgGw",2022-11-24T03:31:05.000Z,1344951,1595620998333988864,['1595620998333988864']
5,"Studies show that using ‘green’ ammonia for fertilizer, fuel, and heat could drive down farming’s carbon footprint by as much as 90 percent https://t.co/x6hGXhhB1y",2022-11-24T02:20:57.000Z,1344951,1595603347641630720,['1595603347641630720']
6,"As a young Black woman, @ruha9 saw her pregnancy treated like a problem. So she ditched the doctors for home delivery and found an alternative model for health care: https://t.co/Wv9ClmTV1o",2022-11-24T01:33:04.000Z,1344951,1595591295837290499,['1595591295837290499']
7,"This frog-legged leaf beetle means business. This haunting shot was an image of distinction at this year's Small World Photomicrography Competition.

📸: Yousef Al Habshi https://t.co/L2bfDfrrAV",2022-11-24T01:00:41.000Z,1344951,1595583145923203072,['1595583145923203072']
8,"Whether you're running trails for hours at a time or just want a reminder to stand up once an hour, our Gear team has sourced a fitness tracker that's right for you. https://t.co/wfXRjEAd1m",2022-11-24T00:33:04.000Z,1344951,1595576197731454976,['1595576197731454976']
9,These predictive analytics are conquering more and more spheres of life. And yet no one has asked your permission to make such forecasts. (From 2021) https://t.co/TjQx2GcqW4,2022-11-24T00:03:04.000Z,1344951,1595568647543693313,['1595568647543693313']
10,Is this what a Thanksgiving table should look like? We have some opinions about that. (From 2018) https://t.co/HFVJmu8L7R,2022-11-23T23:33:03.000Z,1344951,1595561095095373827,['1595561095095373827']
11,"To help you figure out the best tent for your next adventure, we've pooled our favorites from years of testing—whether you're getting away for the weekend with the family or soloing Mount Whitney. https://t.co/JvAkQ4RZur",2022-11-23T23:03:03.000Z,1344951,1595553545968705536,['1595553545968705536']
12,"To mark the 60th anniversary of the Bond franchise, two new Omegas have been released that mechanically animate 007’s iconic opening sequence. https://t.co/PbzRo1HV3U",2022-11-23T22:32:07.000Z,1344951,1595545757599277057,['1595545757599277057']
13,Now is the time to create your own content. These tools can help you get great audio and video quality from the start. https://t.co/JhPhuCfXwG,2022-11-23T22:01:03.000Z,1344951,1595537942646517760,['1595537942646517760']
14,"To help you save money, we've hunted down discounts on all our favorite Apple gadgets, and more, from third-party retailers. These are the best Apple #BlackFriday deals around. https://t.co/QP0t4Vv2Yp",2022-11-23T21:33:06.000Z,1344951,1595530905661104128,['1595530905661104128']
15,"Our reviewer was admittedly skeptical of Microsoft's claims about the Xbox Game Pass Ultimate. But buying a steady stream of games for you and your family gets real expensive, real fast. 

It's safe to say he's a convert. https://t.co/eeUno41hmU

📸 Microsoft https://t.co/j80XKtZY4X",2022-11-23T21:00:29.000Z,1344951,1595522698553470977,['1595522698553470977']
16,"We dove, climbed, surfed, and handed these cameras to reckless 10-year-olds on bikes to figure out which cameras could hold up. We found a number of great options that will record, and survive, your future adventures. https://t.co/7pxfHyg8FC",2022-11-23T20:35:06.000Z,1344951,1595516310787887104,['1595516310787887104']
17,These are our favorite (and least favorite) mattresses right now. #WIREDRecommends https://t.co/c4LyueStc4,2022-11-23T20:33:04.000Z,1344951,1595515800474877953,['1595515800474877953']
18,"Join us for Cybercrime Monday on Twitter Spaces on November 28 at 9am PT / Noon ET for a discussion with @a_greenberg, WIRED journalist &amp; author of the new book Tracers In The Dark: The Global Hunt For The Crime Lords Of Cryptocurrency.

Sign up here: https://t.co/pHAZST0iyw https://t.co/hN9X2T8WSg",2022-11-23T20:15:10.000Z,1344951,1595511295733743616,['1595511295733743616']
19,The backlash against food processing is a luxury that the world can’t afford to embrace. https://t.co/dPXsPpnIig,2022-11-23T20:04:02.000Z,1344951,1595508492626010112,['1595508492626010112']
20,"WIRED
Crystal clear 4K video. No subscription needed. Local storage (16 GB built in, expandable up to 16 TB). Two-way audio. People, pet, and vehicle detection. 

TIRED
Expensive. Hub must be connected to your router via Ethernet cable. https://t.co/wovFKFs0VH",2022-11-23T19:31:11.000Z,1344951,1595500226542198784,['1595500226542198784']
21,"The internet is the most technically complex system humanity has ever built. Jim Kurose, Professor at UMass Amherst, has been challenged to explain the internet to 5 different people; a child, a teen, a college student, a grad student, and an expert. https://t.co/88kzegR0pY",2022-11-23T19:00:09.000Z,1344951,1595492415434997760,['1595492415434997760']
22,"We've tested tons of cheap laptops, and for everyday tasks these will do everything you ask of them—and leave some money in your bank account. https://t.co/ZaH5NOhM4u",2022-11-23T18:30:17.000Z,1344951,1595484898911203329,['1595484898911203329']
23,"Elon Musk can’t change Twitter’s history of poor security, or the fact that it has to deal with close scrutiny from the FTC for the next 20 years. https://t.co/oJjqI3S31s",2022-11-23T18:02:09.000Z,1344951,1595477818938269696,['1595477818938269696']
24,"WIRED
Anti-pinch safety features. Nearly silent. Stellar odor control. Roomy drum and large waste drawer. No scooping! 

TIRED
Expensive. Automatic boxes can still be risky. Needs to be near an outlet. Not all cats will use it.
https://t.co/U7LP85wX5W",2022-11-23T17:29:04.000Z,1344951,1595469496172437505,['1595469496172437505']
25,"Hive Social is the newest viral Twitter alternative. If you want to experience what all the buzz is about, here’s how to join, and a few tips for new users. https://t.co/SteTk5wCfJ",2022-11-23T17:02:06.000Z,1344951,1595462708840701953,['1595462708840701953']
26,Picking a VPN is serious business. Each VPN provider on this list has been independently audited by security firms and published the results. https://t.co/ZGQfLDaKsu,2022-11-23T16:31:03.000Z,1344951,1595454892893536257,['1595454892893536257']
27,"WIRED
Lightweight and easy to maneuver. Single-button power control. More suction than its predecessor. Useful LCD screen. Comes with a variety of handy attachments including the laser slim brush.

TIRED
Expensive. Small canister. https://t.co/cg3qUtcbcr",2022-11-23T16:03:05.000Z,1344951,1595447856164646913,['1595447856164646913']
28,"Wondering how to switch iPhones or iPads successfully, without losing anything in the process? We've outlined the steps below. https://t.co/sAI31VAHgB",2022-11-23T15:33:08.000Z,1344951,1595440318157291521,['1595440318157291521']
29,"WIRED has challenged #origami artist and physicist Robert J. Lang to explain origami to 5 different people; a child, teen, a college student, a grad student and an expert: https://t.co/dzqCP6QlYp",2022-11-23T15:00:02.000Z,1344951,1595431990534234117,['1595431990534234117']
30,"Clearly, more environmentally friendly approaches to pest control are needed, and there’s one solution that could be about to hit the big time: targeting these pests’ sex drives. Via @WIREDUK https://t.co/SvPtKuObq7",2022-11-23T14:28:06.000Z,1344951,1595423952540680193,['1595423952540680193']
31,"If you’re an Apple user who finds the AirTag’s awesome locating powers to be a little scary—or if you find them hard to attach to your wallet—the Card Spot is the natural pick, and it's much safer. https://t.co/EDZ0ZKZvLQ",2022-11-23T14:04:02.000Z,1344951,1595417897614315522,['1595417897614315522']
32,"Millions of new saplings sprouting each year might seem like a good thing. But in reality, their spread across vulnerable grasslands and shrublands is upending ecosystems and livelihoods.  Via @WIREDUK https://t.co/oEgWvRtZOL",2022-11-23T13:26:02.000Z,1344951,1595408334387286016,['1595408334387286016']
33,"The days of having a separate tea brewer, thermos, and mug are over, says our reviewer. Once you go for Tea Spot's Mountain Tea tumbler, you might never go back: https://t.co/OYPdBhFmLT

📸: The Tea Spot https://t.co/GC5nq74ahe",2022-11-23T13:00:10.000Z,1344951,1595401824059920385,['1595401824059920385']
34,"Best Buy has posted tons of early Black Friday deals ahead of schedule. If you see one you like, jump on it now rather than waiting for Thanksgiving to pass you by.  #BlackFriday https://t.co/I8TvPSS29w",2022-11-23T12:28:04.000Z,1344951,1595393747285692422,['1595393747285692422']
35,"“People are using it. And it’s not just people shouting into a void, either. People are engaging.”  Amid Twitter chaos and Donald Trump’s 2024 presidential bid, Truth Social is having a moment of its own. https://t.co/l4xZ9BhqkV 
🎨: James Marshall https://t.co/m1EmmCHfGO",2022-11-23T12:04:06.000Z,1344951,1595387713682743297,['1595387713682743297']
36,"Dive into 2023 with predictions from Jennifer Doudna, Ellen MacArthur and more. The WIRED World 2023 is your exclusive guide to the year ahead. 

Click here to grab your copy: https://t.co/rV6xJQuho5

🎨: Oliver Hazelwood https://t.co/NaNNJw2BRi",2022-11-23T11:27:03.000Z,1344951,1595378389656870918,['1595378389656870918']
37,What do you get for the person who has everything? Read this article to find out. https://t.co/GWYyvjmJR4,2022-11-23T10:35:05.000Z,1344951,1595365312370614272,['1595365312370614272']
38,"Ebooks can be tools for learning, escaping or both. https://t.co/MZFucU64tS",2022-11-23T10:04:02.000Z,1344951,1595357499133149187,['1595357499133149187']
39,"Researchers have found that at the base of Antarctica’s ice, an area the size of Germany and France combined is feeding meltwater into a super-pressurized, 290-mile-long river running to the sea. It could be terrible news for sea level rise: https://t.co/Nl1DfauTwO

📸: Getty https://t.co/zXKTYyzxI3",2022-11-23T09:01:00.000Z,1344951,1595341635961131010,['1595341635961131010']
40,"#Andor star Diego Luna (@diegoluna_) ""can't wait"" for fans to see the show's second season. https://t.co/COXIWTiJ2o 
📷: Lucasfilm Ltd. &amp; TM https://t.co/xc9otAMFPW",2022-11-23T08:04:06.000Z,1344951,1595327313750953984,['1595327313750953984']
41,"Keith Masback, former Director of Intelligence, Surveillance, &amp; Reconnaissance Integration for the US Army, provides a few tips &amp; tricks for what people like him are generally looking for in satellite imagery.  
Made in collaboration with @IntlSpyMuseum https://t.co/qSFYyt7BL1",2022-11-23T07:00:01.000Z,1344951,1595311190133071872,['1595311190133071872']
42,"Your trusty PS4 has served you well for years. Should you really just toss it aside and sell it? It turns out it might have more value to you repurposed than it would on the market. 

Here's how to bring glory back to your PS4: https://t.co/z3eJt4PUdb",2022-11-23T06:59:28.000Z,1344951,1595311049384902658,['1595311049384902658']
43,"Researchers found a cloud infrastructure error in 1,859 publicly available apps on both Android and iOS. It could provide access to private files.  https://t.co/0OuYKVjZqE",2022-11-23T06:01:22.000Z,1344951,1595296427332505600,['1595296427332505600']
44,The hardest part about having a chronic illness is its key characteristic: it’s lifelong. But apps can empower patients to improve their health. https://t.co/M0l3qtnULM,2022-11-23T05:01:40.000Z,1344951,1595281404300066816,['1595281404300066816']
45,These are our favorite massage guns. https://t.co/hJthXVd2ws,2022-11-23T04:01:05.000Z,1344951,1595266160181870595,['1595266160181870595']
46,"These accessories are affordable, and they make great gifts too. https://t.co/oFAmp1HZ2C",2022-11-23T03:34:04.000Z,1344951,1595259361726631937,['1595259361726631937']
47,The right pair of wireless headphones can make or break your day. The only problem is that there are so many to choose from. WIRED's Gear team is here to help. https://t.co/wwbaJfoBnr,2022-11-23T03:02:05.000Z,1344951,1595251312727412736,['1595251312727412736']
48,"Dr. Michio Kaku, a professor of theoretical physics, answers the internet's burning questions about physics. Can Michio explain ""string theory"" to the layperson? What is a quark? How do black holes distort time? Michio answers all these questions and more: https://t.co/TNCDgYPjPO",2022-11-23T03:00:03.000Z,1344951,1595250798707048448,['1595250798707048448']
49,"Digital picture frames are nice to have around the house, and they also make great gifts. https://t.co/T4sZpEdCM5",2022-11-23T02:31:06.000Z,1344951,1595243514782171136,['1595243514782171136']
50,"Feet were made to stretch, flex, roll, and bend, and letting them do what they evolved to do can reduce impact injuries and provide a host of other benefits. https://t.co/hAZWliGCzW",2022-11-23T02:02:04.000Z,1344951,1595236206291320833,['1595236206291320833']
51,"Slowly but steadily, ubiquitous biometric technology systems have come to represent a new normal for stadium infrastructure in which “health securitization” is incorporated into systems for public safety and marketing. https://t.co/zDKIMLhISN",2022-11-23T01:32:07.000Z,1344951,1595228669852766209,['1595228669852766209']
52,"Sometimes you don't realize what you’ve been missing out on until it finally happens. For our writer, it was hearing their Chinese mother tell them she loved them for the first time—at 39 years old.

A language translation app helped make that possible: https://t.co/YoKrRnySGs https://t.co/NCyQQeT9Sa",2022-11-23T01:00:41.000Z,1344951,1595220757617184769,['1595220757617184769']
53,"Twitter, which no longer has any communications staff after the recent layoffs, did not respond to a request for comment. https://t.co/omZn6Qsg17",2022-11-23T00:32:06.000Z,1344951,1595213564721397760,['1595213564721397760']
54,Truly no supply chain was safe from the ravages of pandemic-imposed chaos and logjams. Not even those that supply America's legion of bomb-sniffing puppers. https://t.co/IBD4k9eO2Q,2022-11-23T00:02:05.000Z,1344951,1595206013921030144,['1595206013921030144']
55,"Are robots destined to take our jobs? Actually, evidence indicates that we can influence how new technology is employed within our factories and offices—if we can only figure out how to wield this power. https://t.co/GKJjUKBK8j",2022-11-22T23:34:05.000Z,1344951,1595198965041008641,['1595198965041008641']
56,"There’s never a bad time to invest in a little extra self-care. These are some of our favorite sex toys, vibrators, smart vibrators, personal wand massagers, and accessories, all of which we’ve personally tested. https://t.co/F0Hp9tVBc1",2022-11-22T23:03:03.000Z,1344951,1595191155297505280,['1595191155297505280']
57,"""A disaster, I used to believe, calls for a hero. Maybe that hero could even be me, a bike-addicted mom of two"". https://t.co/kE2uaEbfXZ",2022-11-22T22:33:07.000Z,1344951,1595183624923406336,['1595183624923406336']
58,These steps will make it easier to get your data back if something bad happens. https://t.co/JoqkFji7Km,2022-11-22T22:03:03.000Z,1344951,1595176055236661250,['1595176055236661250']
59,"Once you get on the smart bulb train, you'll never go back. https://t.co/QrHylaNnLM",2022-11-22T21:34:04.000Z,1344951,1595168763275579418,['1595168763275579418']
60,"Shopping for a PC gamer is a perilous endeavor. But what is a PC gamer but an adventurer—a reclusive one, perhaps, but an adventurer nonetheless! And this guide can help: https://t.co/DgiG5DFQ6G

📸: HyperX https://t.co/Xc1066gJDo",2022-11-22T21:00:32.000Z,1344951,1595160323098804224,['1595160323098804224']
61,The question of whether an AI program might become sentient has been debated for decades. Now a Google engineer says one of its AI programs has done just that: https://t.co/nQnynTG9HR,2022-11-22T20:32:03.000Z,1344951,1595153156937244672,['1595153156937244672']
62,"Follow the untold story of the biggest dark web market takedown of all time with exclusive commentary from senior writer Andy Greenberg (@a_greenberg) by subscribing to a limited series of six newsletters. 

Sign up here: https://t.co/ueoWqyG79g https://t.co/InyaYndwGX",2022-11-22T20:12:03.000Z,1344951,1595148121755226112,['1595148121755226112']
63,"Critics of Google Scholar say it subjects trans academics and researchers to deadnaming, the unwelcome and even traumatic mention of a transgender person’s name from before they transitioned. https://t.co/0qlKmaSTKt",2022-11-22T20:01:02.000Z,1344951,1595145349424988183,['1595145349424988183']
64,"WIRED
Simple. Light. Fun to ride! Clean design—no exposed cables. Comes with all the fixin’s, like a bell, lights, kickstand, and rear rack. 

TIRED
No LCD display or throttle. No fancy features like a belt drive or continuously variable transmission. https://t.co/RsrOEHfFHV",2022-11-22T19:32:03.000Z,1344951,1595138057153527811,['1595138057153527811']
65,https://t.co/snouCSgZeT,2022-11-22T19:29:09.000Z,1344951,1595137326463623168,['1595137326463623168']
66,Robotics professor @hadmoni answers the internet's burning questions about robots! https://t.co/wmnuoUnEME,2022-11-22T19:00:03.000Z,1344951,1595130003707920385,['1595130003707920385']
67,"FTX might be doomed, but a small group of volunteers believes that Serum, Sam Bankman-Fried’s other crypto exchange, is worth saving. https://t.co/rQjRKFnGWy",2022-11-22T18:39:03.000Z,1344951,1595124719019343880,['1595124719019343880']
68,"Using five years’ worth of data, a team led by scientists at Colorado State University confirmed a long-suspected link between ambient air quality and racial residential segregation. https://t.co/v4cvx59TiL",2022-11-22T18:05:06.000Z,1344951,1595116175687823360,['1595116175687823360']
69,Yes—this wireless whipper performs just as well as its corded counterparts. But do you really need to cut the cord on your hand mixer?  https://t.co/Ta27EAthtp,2022-11-22T17:30:17.000Z,1344951,1595107411571998724,['1595107411571998724']
70,"WIRED
A contemporary new look. Fine for basic productivity needs. Good battery life. Pleasingly portable. 

TIRED
Frustrating performance. “Infinity Edge” is gone in all but name. Underwhelming keyboard and trackpad. Patchy key backlighting. https://t.co/p2SvnXDAtc",2022-11-22T17:03:04.000Z,1344951,1595100564861628419,['1595100564861628419']
71,"This is the MRI of a woman who was born missing a chunk of her brain. Doctors told her she should have seizures, or that she shouldn’t have a good vocabulary. But actually, her brain seemed to work perfectly fine: https://t.co/oIWdb2rxxT",2022-11-22T16:36:06.000Z,1344951,1595093776988573700,['1595093776988573700']
72,Filmmaker Mode is meant to make movies look—as the name implies—like the filmmaker intended. https://t.co/t5x6OJPxjU,2022-11-22T16:02:06.000Z,1344951,1595085220604157958,['1595085220604157958']
73,"WIRED
Easy setup. Works seamlessly. Relatively low internet speed requirements. 

TIRED
$15 monthly subscription fee. Doesn't work as an audio interface offline. https://t.co/Z0SWf1xw1C",2022-11-22T15:26:03.000Z,1344951,1595076148526043137,['1595076148526043137']
74,Click here to learn more: https://t.co/Q5oKxe3B8f,2022-11-22T15:06:36.000Z,1344951,1595071251844038662,['1595071251844038662']
75,"Read the fifth installment of  ​​@a_greenberg’s unbelievable tale of the biggest dark web bust of all time, and sign up for our newsletter to receive the next three parts of the series weekly. https://t.co/OxMZkgehML 14/14",2022-11-22T14:54:47.000Z,1344951,1595068279047028737,['1595068279047028737']
76,"Cazes attorney, Roger Bonakdar, immediately doubted the story that his client had killed himself, and he told Rabenn as much. Over the months that followed, he requested the video footage of Cazes' cell at the time of his death. He received neither. 13/14 https://t.co/JywsaYcDCd",2022-11-22T14:54:46.000Z,1344951,1595068276379422723,['1595068276379422723']
77,"When Sanchez arrived at Cazes' cell, it appeared to be empty, but Thai officers were peering over the cell's internal 3-foot wall. She walked in and looked down: Cazes' body, hidden behind that wall, was sprawled across the cell's bathroom area. 12/14 https://t.co/f5NOjezskY",2022-11-22T14:54:45.000Z,1344951,1595068271589466112,['1595068271589466112']
78,"During one late-night visit, this one on July 11, six days after his arrest, Cazes told Sanchez that he planned to escape—that a helicopter gunship was coming to break him out. Sanchez brushed it off as a joke. Then, the next day, the unthinkable happened. 11/14 https://t.co/8Kui14n4iz",2022-11-22T14:54:44.000Z,1344951,1595068266917117952,['1595068266917117952']
79,"One DEA agent, Jen Sanchez was given the job of speaking with Cazes and persuading him to agree to extradition. She didn’t have the authority to offer much to Cazes in exchange for his cooperation. But she tried to show him kindness, to help him keep his spirits up. 10/14",2022-11-22T14:54:43.000Z,1344951,1595068262462754823,['1595068262462754823']
80,"Following his arrest, Cazes was taken to a Thai police building, where prosecutors hoped to persuade him to sign an extradition agreement, allowing them to deport him from Bangkok without a lengthy legal battle—and more ambitiously, to make him an informant. 9/14",2022-11-22T14:54:42.000Z,1344951,1595068260789223424,['1595068260789223424']
81,"Finally an agent nicknamed M broke free of the melee. His make-or-break assignment had arrived. He raced into the house, up the stairs, and into Cazes’ bedroom. There it was, on a cheap white desk: Cazes' laptop. It was open. 8/14 https://t.co/Xl6fDdUotp",2022-11-22T14:54:42.000Z,1344951,1595068258478182400,['1595068258478182400']
82,"Cazes spun around, now in fight-or-flight mode, desperate to get back inside to his laptop. But one Thai officer and then another suddenly appeared, grabbing Cazes and wrestling him to the ground. 7/14",2022-11-22T14:54:41.000Z,1344951,1595068254099496960,['1595068254099496960']
83,"For a few moments, Cazes tugged at the gate, trying to get it back on its rails. Then he saw that one of the undercover agents, who had been posing as an electrician, was now sprinting towards him and wearing a police vest. 6/14",2022-11-22T14:54:40.000Z,1344951,1595068252006514688,['1595068252006514688']
84,"The undercover agent behind the wheel, doggedly playing her part, shouted—as loudly as possible, trying to project so that Cazes could hear inside the house—that she needed to pay for the damage. A few seconds later, the kingpin finally emerged out of the house. 5/14",2022-11-22T14:54:40.000Z,1344951,1595068249842286592,['1595068249842286592']
85,"Police signaled for undercover agents to launch their plan: Crashing a Toyota Camry into his gate in an effort to lure him away from his laptop. Seconds later, a loud clang rang out across the cul-de-sac, Cazes’s wife came out of the house to assess the situation. 4/14",2022-11-22T14:54:39.000Z,1344951,1595068247971430400,['1595068247971430400']
86,"But before the team in Lithuania could finish their work, they accidentally crashed the AlphaBay server. It was now only a matter of time before Cazes realized something was amiss. The moment he closed his laptop, triggering its encryption, the operation would be over. 3/14 https://t.co/17OIqywZ9K",2022-11-22T14:54:39.000Z,1344951,1595068245287272451,['1595068245287272451']
87,"In a war-room across the city, agents and prosecutors monitored video-feeds of the scene. At the center of the long table was a conference phone connected to both the Thai team on the ground and another team of agents in Lithuania, tasked with imaging the AlphaBay server. 2/14",2022-11-22T14:54:38.000Z,1344951,1595068241260564480,['1595068241260564480']
88,"On the morning of July 5th, on the Bangkok street where Alexandre Cazes lived, half a dozen undercover agents waited for their cues to begin an elaborate sting. The goal: To take down AlphaBay’s boss once and for all. 🎨: @hogingkim https://t.co/OxMZkgePCj 1/14 https://t.co/Cyd0OmME8S",2022-11-22T14:54:37.000Z,1344951,1595068237636833282,['1595068237636833282']
89,"Whether you want to battle Star Wars spaceships or shoot a cinematic masterpiece, we've got a great drone option for you. https://t.co/P541icRkDX",2022-11-22T14:32:06.000Z,1344951,1595062569970143232,['1595062569970143232']
